comment,source,date,location
The revised business grant scheme genuinely helped us survive the slow season.,Resident Survey,2025-01-15,District 3
Another property tax hike with zero improvement in local services is inexcusable.,Public Forum,2025-01-08,District 7
Corporate incentives for the new tech park will create high-paying jobs. Strong policy.,Business Association,2025-01-22,Industrial Zone
Hiking sales tax on essentials during a cost-of-living crisis shows total disregard for families.,Community Email,2025-01-05,District 1
The economic regeneration zone has brought three new employers to our district this year.,Chamber of Commerce,2025-02-09,East Quarter
The council's budget transparency portal is excellent — every citizen should use it.,Online Submission,2025-02-24,City Centre
Hidden fees in the new business licensing process are driving small traders away.,Market Traders Forum,2025-03-11,Market District
Reducing stamp duty for first-time buyers is exactly the kind of targeted relief we needed.,First Home Buyers Group,2025-03-31,District 5
The segregated cycle highway on the waterfront is world-class — our city finally gets it.,Cycling Campaign,2025-01-12,Waterfront
Unrepaired sinkholes on the industrial estate have damaged two delivery vehicles this month.,Business Park Residents,2025-01-18,Industrial Estate
The new intercity rail link will transform commuting and reduce congestion enormously.,Commuter Association,2025-01-28,Central Station
Bus routes cut by 40% since last year — rural communities are completely isolated now.,Rural Residents Forum,2025-02-04,Outskirts
EV charging stations in every council car park by year-end is an ambitious but achievable target.,Green Transport Group,2025-02-19,District 4
The harbour bridge closure with zero alternative route was catastrophically mismanaged.,Harbour District Residents,2025-02-29,Harbour
Pavement tactile paving upgrades across the city centre have improved accessibility significantly.,Disability Access Forum,2025-03-16,City Centre
Flood drainage on the south ring road is completely inadequate — it floods every winter.,South District Residents,2025-03-26,South Ring
Smart traffic signals at the five busiest junctions have cut rush-hour delays by 18%.,Transport Watch,2025-04-10,City Centre
The long-promised footbridge connecting the station to the business park is still not built.,Business Park Workers,2025-04-20,Station Quarter
The community land trust pilot in Westgate is the most progressive housing policy in years.,Housing Action Group,2025-01-20,Westgate
Retrospective planning approval for the illegal riverside development sets a terrible precedent.,Planning Watch,2025-01-30,Riverside
Purpose-built student accommodation near the university is relieving pressure on family housing.,University District Residents,2025-02-14,University Quarter
Permitted development rights abuse is converting quality office space into substandard flats.,Renters Union,2025-02-27,Business District
The rent-to-buy scheme gave my family a realistic pathway to ownership after seven years of renting.,Community Forum,2025-03-13,District 9
Green-belt encroachment for luxury estates while social housing waiting lists grow is unforgivable.,Green Belt Alliance,2025-03-23,Outskirts
Retrofit grants for Victorian terraces will reduce emissions and fuel poverty simultaneously.,Environmental Trust,2025-04-06,Old Town
The planning portal redesign is a genuine improvement — applications take half the time now.,Property Developers Forum,2025-04-16,City Hall
Mixed-tenure social housing developments foster much healthier communities than segregated estates.,Social Housing Research,2025-04-30,District 2
The river rewilding project has restored otter and kingfisher populations. Remarkable work.,Wildlife Trust,2025-01-10,River Corridor
Industrial effluent discharge near the estuary has not been properly investigated despite reports.,Environmental Watch,2025-01-25,Estuary
Community allotment expansion programme has a two-year waiting list — scale it up urgently.,Allotment Society,2025-02-07,Park District
The new air quality monitoring network finally gives us real-time data to hold polluters accountable.,Clean Air Campaign,2025-02-21,Industrial Zone
Replacing grass verges with wildflower meadows is beautiful cheap and brilliant for biodiversity.,Nature Recovery Group,2025-03-07,District 6
Single-use plastic ban in council-run venues should extend to all licensed premises immediately.,Plastic Free Campaign,2025-03-19,City Centre
The waste-to-energy plant proposal near primary schools is deeply alarming and must be refused.,Parents for Clean Air,2025-04-03,North District
Urban tree canopy target of 25% by 2030 is ambitious and the right direction for climate resilience.,Climate Action Group,2025-04-14,City Wide
Contaminated land remediation at the old gasworks site is long overdue — residents deserve answers.,Gasworks Residents,2025-04-28,Gasworks Quarter
Neighbourhood watch digital integration with the council portal has visibly reduced burglaries.,Neighbourhood Watch,2025-01-14,District 8
Knife crime intervention programmes for at-risk youth deserve far more sustained investment.,Youth Work Network,2025-02-01,East Quarter
Ambulance response times in rural postcodes remain dangerously above the national target.,Rural Health Forum,2025-02-15,Rural Areas
The new community safety hub brings police social services and housing under one roof. Excellent.,Council Consultation,2025-03-03,Safety Hub
CCTV expansion without a clear data governance policy is surveillance creep not public safety.,Civil Liberties Group,2025-03-17,City Wide
The fire station closure in Millbrook leaves 15000 residents with unacceptably slow coverage.,Millbrook Residents,2025-04-01,Millbrook
Early years literacy programme results show a 22% improvement in school readiness. Keep investing.,Head Teachers Forum,2025-01-17,School District
Adult education centre cuts mean workers cannot access the retraining they need after redundancy.,Workers Education Trust,2025-02-03,Learning Quarter
Free school meals extension to all primary pupils is a straightforward public health intervention.,Parent Teacher Associations,2025-02-17,City Wide
The new community hub model co-locating library health and job-centre services is inspired.,Community Development Forum,2025-03-05,Community Hub
Special educational needs funding shortfall is forcing schools to exclude children who need support.,SEN Parents Forum,2025-03-22,City Wide
Digital inclusion tablets for care home residents bridging the connectivity gap — wonderful scheme.,Age UK Branch,2025-04-08,Care District
Closing the only youth centre in Northfield will push teenagers onto streets. Short-sighted saving.,Youth Forum,2025-04-22,Northfield
Graduate retention grants for healthcare professionals have reduced vacancy rates by a third.,NHS Trust Partnership,2025-05-06,Hospital Quarter
